"No.","Time","Source","Destination","Protocol","Length","Info"
"1","0.000000","10.90.119.247","17.253.108.253","NTP","90","NTP Version 4, client"
"2","0.047890","104.85.8.212","10.90.119.247","TLSv1.2","90","Application Data"
"3","0.047943","10.90.119.247","104.85.8.212","TCP","54","60769  >  443 [RST] Seq=1 Win=0 Len=0"
"4","0.636728","162.125.69.13","10.90.119.247","TLSv1.2","112","Application Data"
"5","0.636864","10.90.119.247","162.125.69.13","TCP","66","60657  >  443 [ACK] Seq=1 Ack=47 Win=2047 Len=0 TSval=648036855 TSecr=320557392"
"6","0.638002","162.125.69.19","10.90.119.247","TLSv1.2","112","Application Data"
"7","0.638042","10.90.119.247","162.125.69.19","TCP","66","60659  >  443 [ACK] Seq=1 Ack=47 Win=2047 Len=0 TSval=648036856 TSecr=2819797630"
"8","0.638043","10.90.119.247","162.125.69.13","TLSv1.2","112","Application Data"
"9","0.638096","10.90.119.247","162.125.69.13","TLSv1.2","97","Encrypted Alert"
"10","0.638837","10.90.119.247","162.125.69.19","TLSv1.2","112","Application Data"
"11","0.638837","10.90.119.247","162.125.69.19","TLSv1.2","97","Encrypted Alert"
"12","0.669683","162.125.69.13","10.90.119.247","TCP","66","443  >  60657 [ACK] Seq=47 Ack=47 Win=130 Len=0 TSval=320557516 TSecr=648036856"
"13","0.670889","162.125.69.13","10.90.119.247","TLSv1.2","97","Encrypted Alert"
"14","0.670890","162.125.69.13","10.90.119.247","TCP","66","443  >  60657 [FIN, ACK] Seq=78 Ack=79 Win=130 Len=0 TSval=320557517 TSecr=648036856"
"15","0.670969","10.90.119.247","162.125.69.13","TCP","54","60657  >  443 [RST] Seq=79 Win=0 Len=0"
"16","0.670969","10.90.119.247","162.125.69.13","TCP","54","60657  >  443 [RST] Seq=79 Win=0 Len=0"
"17","0.673029","162.125.69.19","10.90.119.247","TCP","66","443  >  60659 [ACK] Seq=47 Ack=47 Win=130 Len=0 TSval=2819797753 TSecr=648036856"
"18","0.673682","162.125.69.19","10.90.119.247","TLSv1.2","97","Encrypted Alert"
"19","0.673754","10.90.119.247","162.125.69.19","TCP","54","60659  >  443 [RST] Seq=79 Win=0 Len=0"
"20","0.673905","162.125.69.19","10.90.119.247","TCP","66","443  >  60659 [FIN, ACK] Seq=78 Ack=79 Win=130 Len=0 TSval=2819797753 TSecr=648036856"
"21","0.673938","10.90.119.247","162.125.69.19","TCP","54","60659  >  443 [RST] Seq=79 Win=0 Len=0"
"22","1.293064","10.90.119.247","151.100.4.2","DNS","95","Standard query 0x2db6 A api.apple-cloudkit.fe.apple-dns.net"
"23","1.295623","10.90.119.247","17.248.248.50","TCP","78","60815  >  443 [SYN, ECE, CWR] Seq=0 Win=65535 Len=0 MSS=1460 WS=64 TSval=648037509 TSecr=0 SACK_PERM"
"24","1.298194","151.100.4.2","10.90.119.247","DNS","223","Standard query response 0x2db6 A api.apple-cloudkit.fe.apple-dns.net A 17.248.248.69 A 17.248.248.53 A 17.248.145.101 A 17.248.145.143 A 17.248.145.145 A 17.248.145.209 A 17.248.248.12 A 17.248.145.170"
"25","1.325027","17.248.248.50","10.90.119.247","TCP","74","443  >  60815 [SYN, ACK, ECE] Seq=0 Ack=1 Win=65160 Len=0 MSS=1460 SACK_PERM TSval=1092410254 TSecr=648037509 WS=128"
"26","1.325088","10.90.119.247","17.248.248.50","TCP","66","60815  >  443 [ACK] Seq=1 Ack=1 Win=131712 Len=0 TSval=648037538 TSecr=1092410254"
"27","1.325629","10.90.119.247","17.248.248.50","TLSv1.3","583","Client Hello"
"28","1.357205","17.248.248.50","10.90.119.247","TCP","66","443  >  60815 [ACK] Seq=1 Ack=518 Win=64768 Len=0 TSval=1092410284 TSecr=648037538"
"29","1.357867","17.248.248.50","10.90.119.247","TLSv1.3","1514","Server Hello, Change Cipher Spec, Application Data"
"30","1.358354","17.248.248.50","10.90.119.247","TCP","1514","443  >  60815 [PSH, ACK] Seq=1449 Ack=518 Win=64768 Len=1448 TSval=1092410285 TSecr=648037538 [TCP segment of a reassembled PDU]"
"31","1.358409","10.90.119.247","17.248.248.50","TCP","66","60815  >  443 [ACK] Seq=518 Ack=2897 Win=129600 Len=0 TSval=648037570 TSecr=1092410285"
"32","1.358986","17.248.248.50","10.90.119.247","TCP","1266","443  >  60815 [PSH, ACK] Seq=2897 Ack=518 Win=64768 Len=1200 TSval=1092410285 TSecr=648037538 [TCP segment of a reassembled PDU]"
"33","1.358988","17.248.248.50","10.90.119.247","TLSv1.3","880","Application Data, Application Data, Application Data"
"34","1.359109","10.90.119.247","17.248.248.50","TCP","66","60815  >  443 [ACK] Seq=518 Ack=4097 Win=129856 Len=0 TSval=648037570 TSecr=1092410285"
"35","1.359109","10.90.119.247","17.248.248.50","TCP","66","60815  >  443 [ACK] Seq=518 Ack=4911 Win=129024 Len=0 TSval=648037570 TSecr=1092410285"
"36","1.365716","10.90.119.247","151.100.4.2","DNS","77","Standard query 0x885d A ocsp.digicert.com"
"37","1.373242","151.100.4.2","10.90.119.247","DNS","125","Standard query response 0x885d A ocsp.digicert.com CNAME cs9.wac.phicdn.net A 117.18.237.29"
"38","1.373928","10.90.119.247","117.18.237.29","TCP","78","60816  >  80 [SYN, ECE, CWR] Seq=0 Win=65535 Len=0 MSS=1460 WS=64 TSval=648037585 TSecr=0 SACK_PERM"
"39","1.454206","10.90.119.247","151.100.4.2","DNS","80","Standard query 0x9f11 A ocsp-a.g.aaplimg.com"
"40","1.454752","10.90.119.247","23.32.10.14","TCP","78","60817  >  80 [SYN, ECE, CWR] Seq=0 Win=65535 Len=0 MSS=1460 WS=64 TSval=648037665 TSecr=0 SACK_PERM"
"41","1.457792","151.100.4.2","10.90.119.247","DNS","112","Standard query response 0x9f11 A ocsp-a.g.aaplimg.com A 17.253.57.208 A 17.253.57.203"
"42","1.470455","23.32.10.14","10.90.119.247","TCP","74","80  >  60817 [SYN, ACK, ECE] Seq=0 Ack=1 Win=65160 Len=0 MSS=1460 SACK_PERM TSval=1003297327 TSecr=648037665 WS=128"
"43","1.470531","10.90.119.247","23.32.10.14","TCP","66","60817  >  80 [ACK] Seq=1 Ack=1 Win=131712 Len=0 TSval=648037680 TSecr=1003297327"
"44","1.471028","10.90.119.247","23.32.10.14","HTTP","366","GET /ocsp04-devid01/ME4wTKADAgEAMEUwQzBBMAkGBSsOAwIaBQAEFDOB0e%2FbaLCFIU0u76%2BMSmlkPCpsBBRXF%2B2iz9x8mKEQ4Py%2Bhy0s8uMXVAIIGsIX3XOPkts%3D HTTP/1.1 "
"45","1.486385","23.32.10.14","10.90.119.247","TCP","66","80  >  60817 [ACK] Seq=1 Ack=301 Win=64896 Len=0 TSval=1003297343 TSecr=648037680"
"46","1.489275","23.32.10.14","10.90.119.247","TCP","1514","80  >  60817 [ACK] Seq=1 Ack=301 Win=64896 Len=1448 TSval=1003297344 TSecr=648037680 [TCP segment of a reassembled PDU]"
"47","1.489278","23.32.10.14","10.90.119.247","TCP","118","[TCP Previous segment not captured] 80  >  60817 [PSH, ACK] Seq=2897 Ack=301 Win=64896 Len=52 TSval=1003297344 TSecr=648037680 [TCP segment of a reassembled PDU]"
"48","1.489336","10.90.119.247","23.32.10.14","TCP","78","60817  >  80 [ACK] Seq=301 Ack=1449 Win=130304 Len=0 TSval=648037697 TSecr=1003297344 SLE=2897 SRE=2949"
"49","1.489468","23.32.10.14","10.90.119.247","TCP","1514","[TCP Out-Of-Order] 80  >  60817 [PSH, ACK] Seq=1449 Ack=301 Win=64896 Len=1448 TSval=1003297344 TSecr=648037680"
"50","1.489575","10.90.119.247","23.32.10.14","TCP","66","60817  >  80 [ACK] Seq=301 Ack=2949 Win=129536 Len=0 TSval=648037697 TSecr=1003297344"
"51","1.491234","10.90.119.247","23.32.10.14","TCP","66","60817  >  80 [FIN, ACK] Seq=301 Ack=2949 Win=131072 Len=0 TSval=648037698 TSecr=1003297344"
"52","1.506407","23.32.10.14","10.90.119.247","TCP","66","80  >  60817 [FIN, ACK] Seq=2949 Ack=302 Win=64896 Len=0 TSval=1003297362 TSecr=648037698"
"53","1.506481","10.90.119.247","23.32.10.14","TCP","66","60817  >  80 [ACK] Seq=302 Ack=2950 Win=131072 Len=0 TSval=648037713 TSecr=1003297362"
"54","1.627179","117.18.237.29","10.90.119.247","TCP","74","80  >  60816 [SYN, ACK, ECE] Seq=0 Ack=1 Win=65535 Len=0 MSS=1460 SACK_PERM TSval=2337430395 TSecr=648037585 WS=512"
"55","1.627256","10.90.119.247","117.18.237.29","TCP","66","60816  >  80 [ACK] Seq=1 Ack=1 Win=131712 Len=0 TSval=648037833 TSecr=2337430395"
"56","1.627696","10.90.119.247","117.18.237.29","HTTP","366","GET /MFYwVKADAgEAME0wSzBJMAkGBSsOAwIaBQAEFMEvRXbtFVnssF26ib%2BdgHjlI9QTBBTlnVkwgkdYzKz6CFQ2hns6tQRN8AIQBVLH7%2F7sKSup8Th7B6%2BSnw%3D%3D HTTP/1.1 "
"57","1.890024","117.18.237.29","10.90.119.247","TCP","66","80  >  60816 [ACK] Seq=1 Ack=301 Win=67072 Len=0 TSval=2337430637 TSecr=648037833"
"58","1.890291","117.18.237.29","10.90.119.247","TCP","1514","80  >  60816 [ACK] Seq=1 Ack=301 Win=67072 Len=1448 TSval=2337430638 TSecr=648037833 [TCP segment of a reassembled PDU]"
"59","1.890546","117.18.237.29","10.90.119.247","OCSP","454","Response"
"60","1.890583","10.90.119.247","117.18.237.29","TCP","66","60816  >  80 [ACK] Seq=301 Ack=1837 Win=130624 Len=0 TSval=648038095 TSecr=2337430638"
"61","1.891724","10.90.119.247","117.18.237.29","TCP","66","60816  >  80 [FIN, ACK] Seq=301 Ack=1837 Win=131072 Len=0 TSval=648038096 TSecr=2337430638"
"62","1.893868","10.90.119.247","17.248.248.50","TLSv1.3","146","Change Cipher Spec, Application Data"
"63","1.894651","10.90.119.247","17.248.248.50","TLSv1.3","601","Application Data"
"64","1.895291","10.90.119.247","17.248.248.50","TLSv1.3","134","Application Data"
"65","1.896783","10.90.119.247","17.248.248.69","TCP","78","60818  >  443 [SYN, ECE, CWR] Seq=0 Win=65535 Len=0 MSS=1460 WS=64 TSval=648038100 TSecr=0 SACK_PERM"
"66","1.925322","17.248.248.50","10.90.119.247","TCP","66","443  >  60815 [ACK] Seq=4911 Ack=598 Win=64768 Len=0 TSval=1092410852 TSecr=648038098"
"67","1.925325","17.248.248.69","10.90.119.247","TCP","74","443  >  60818 [SYN, ACK, ECE] Seq=0 Ack=1 Win=65160 Len=0 MSS=1460 SACK_PERM TSval=1328422709 TSecr=648038100 WS=128"
"68","1.925398","10.90.119.247","17.248.248.69","TCP","66","60818  >  443 [ACK] Seq=1 Ack=1 Win=131712 Len=0 TSval=648038128 TSecr=1328422709"
"69","1.925806","10.90.119.247","17.248.248.69","TLSv1.3","583","Client Hello"
"70","1.926082","17.248.248.50","10.90.119.247","TLSv1.3","369","Application Data"
"71","1.926119","10.90.119.247","17.248.248.50","TCP","66","60815  >  443 [ACK] Seq=1201 Ack=5214 Win=130752 Len=0 TSval=648038128 TSecr=1092410853"
"72","1.926612","17.248.248.50","10.90.119.247","TCP","66","443  >  60815 [ACK] Seq=5214 Ack=1133 Win=64256 Len=0 TSval=1092410853 TSecr=648038098"
"73","1.926614","17.248.248.50","10.90.119.247","TCP","66","443  >  60815 [ACK] Seq=5214 Ack=1201 Win=64256 Len=0 TSval=1092410853 TSecr=648038099"
"74","1.927014","17.248.248.50","10.90.119.247","TLSv1.3","369","Application Data"
"75","1.927070","10.90.119.247","17.248.248.50","TCP","66","60815  >  443 [ACK] Seq=1201 Ack=5517 Win=130752 Len=0 TSval=648038129 TSecr=1092410853"
"76","1.927402","17.248.248.50","10.90.119.247","TCP","1514","443  >  60815 [ACK] Seq=5517 Ack=1201 Win=64256 Len=1448 TSval=1092410854 TSecr=648038099 [TCP segment of a reassembled PDU]"
"77","1.927404","17.248.248.50","10.90.119.247","TLSv1.3","1238","Application Data"
"78","1.927430","10.90.119.247","17.248.248.50","TCP","66","60815  >  443 [ACK] Seq=1201 Ack=8137 Win=128448 Len=0 TSval=648038129 TSecr=1092410854"
"79","1.960872","17.248.248.69","10.90.119.247","TCP","66","443  >  60818 [ACK] Seq=1 Ack=518 Win=64768 Len=0 TSval=1328422738 TSecr=648038128"
"80","1.961353","17.248.248.69","10.90.119.247","TLSv1.3","1514","Server Hello, Change Cipher Spec, Application Data"
"81","1.961802","17.248.248.69","10.90.119.247","TCP","1514","443  >  60818 [PSH, ACK] Seq=1449 Ack=518 Win=64768 Len=1448 TSval=1328422738 TSecr=648038128 [TCP segment of a reassembled PDU]"
"82","1.961844","10.90.119.247","17.248.248.69","TCP","66","60818  >  443 [ACK] Seq=518 Ack=2897 Win=129600 Len=0 TSval=648038163 TSecr=1328422738"
"83","1.961975","17.248.248.69","10.90.119.247","TCP","1266","443  >  60818 [PSH, ACK] Seq=2897 Ack=518 Win=64768 Len=1200 TSval=1328422738 TSecr=648038128 [TCP segment of a reassembled PDU]"
"84","1.961977","17.248.248.69","10.90.119.247","TLSv1.3","881","Application Data, Application Data, Application Data"
"85","1.962014","10.90.119.247","17.248.248.69","TCP","66","60818  >  443 [ACK] Seq=518 Ack=4097 Win=129856 Len=0 TSval=648038164 TSecr=1328422738"
"86","1.962014","10.90.119.247","17.248.248.69","TCP","66","60818  >  443 [ACK] Seq=518 Ack=4912 Win=129024 Len=0 TSval=648038164 TSecr=1328422739"
"87","1.968663","10.90.119.247","17.248.248.69","TLSv1.3","146","Change Cipher Spec, Application Data"
"88","1.969332","10.90.119.247","17.248.248.69","TLSv1.3","631","Application Data"
"89","1.969521","10.90.119.247","17.248.248.69","TLSv1.3","165","Application Data"
"90","2.000282","10.90.119.247","17.253.108.253","NTP","90","NTP Version 4, client"
"91","2.026181","17.248.248.69","10.90.119.247","TCP","66","443  >  60818 [ACK] Seq=4912 Ack=598 Win=64768 Len=0 TSval=1328422793 TSecr=648038170"
"92","2.026396","17.248.248.69","10.90.119.247","TLSv1.3","369","Application Data"
"93","2.026399","17.248.248.69","10.90.119.247","TLSv1.3","369","Application Data"
"94","2.026445","10.90.119.247","17.248.248.69","TCP","66","60818  >  443 [ACK] Seq=1262 Ack=5215 Win=130752 Len=0 TSval=648038227 TSecr=1328422793"
"95","2.026445","10.90.119.247","17.248.248.69","TCP","66","60818  >  443 [ACK] Seq=1262 Ack=5518 Win=130432 Len=0 TSval=648038227 TSecr=1328422794"
"96","2.026718","17.248.248.69","10.90.119.247","TCP","66","443  >  60818 [ACK] Seq=5518 Ack=1163 Win=64256 Len=0 TSval=1328422794 TSecr=648038170"
"97","2.026720","17.248.248.69","10.90.119.247","TCP","66","443  >  60818 [ACK] Seq=5518 Ack=1262 Win=64256 Len=0 TSval=1328422794 TSecr=648038170"
"98","2.028061","17.248.248.69","10.90.119.247","TLSv1.3","1175","Application Data"
"99","2.028093","10.90.119.247","17.248.248.69","TCP","66","60818  >  443 [ACK] Seq=1262 Ack=6627 Win=129920 Len=0 TSval=648038228 TSecr=1328422795"
"100","2.063301","10.90.119.247","17.248.248.50","TLSv1.3","631","Application Data"
"101","2.063503","10.90.119.247","17.248.248.50","TLSv1.3","165","Application Data"
"102","2.139847","10.90.119.247","17.248.248.50","TCP","730","[TCP Retransmission] 60815  >  443 [PSH, ACK] Seq=1201 Ack=8137 Win=131072 Len=664 TSval=648038339 TSecr=1092410854"
"103","2.142103","17.248.248.50","10.90.119.247","TCP","66","443  >  60815 [ACK] Seq=8137 Ack=1865 Win=64128 Len=0 TSval=1092411020 TSecr=648038263"
"104","2.142432","17.248.248.50","10.90.119.247","TLSv1.3","1176","Application Data"
"105","2.142434","117.18.237.29","10.90.119.247","TCP","66","80  >  60816 [FIN, ACK] Seq=1837 Ack=302 Win=67072 Len=0 TSval=2337430902 TSecr=648038096"
"106","2.142467","10.90.119.247","17.248.248.50","TCP","66","60815  >  443 [ACK] Seq=1865 Ack=9247 Win=129920 Len=0 TSval=648038341 TSecr=1092411022"
"107","2.142520","10.90.119.247","117.18.237.29","TCP","66","60816  >  80 [ACK] Seq=302 Ack=1838 Win=131072 Len=0 TSval=648038341 TSecr=2337430902"
"108","2.158575","10.90.119.247","17.248.248.50","TLSv1.3","631","Application Data"
"109","2.158797","10.90.119.247","17.248.248.50","TLSv1.3","165","Application Data"
"110","2.171630","17.248.248.50","10.90.119.247","TCP","78","[TCP Dup ACK 103#1] 443  >  60815 [ACK] Seq=9247 Ack=1865 Win=64128 Len=0 TSval=1092411101 TSecr=648038339 SLE=1201 SRE=1865"
"111","2.189853","17.248.248.50","10.90.119.247","TCP","66","443  >  60815 [ACK] Seq=9247 Ack=2430 Win=64128 Len=0 TSval=1092411117 TSecr=648038357"
"112","2.189856","17.248.248.50","10.90.119.247","TCP","66","443  >  60815 [ACK] Seq=9247 Ack=2529 Win=64128 Len=0 TSval=1092411117 TSecr=648038357"
"113","2.191854","17.248.248.50","10.90.119.247","TLSv1.3","1176","Application Data"
"114","2.191888","10.90.119.247","17.248.248.50","TCP","66","60815  >  443 [ACK] Seq=2529 Ack=10357 Win=129920 Len=0 TSval=648038389 TSecr=1092411119"
"115","2.209421","10.90.119.247","17.253.57.208","TCP","78","60819  >  80 [SYN, ECE, CWR] Seq=0 Win=65535 Len=0 MSS=1460 WS=64 TSval=648038406 TSecr=0 SACK_PERM"
"116","2.241798","17.253.57.208","10.90.119.247","TCP","74","80  >  60819 [SYN, ACK, ECE] Seq=0 Ack=1 Win=64980 Len=0 MSS=1456 SACK_PERM TSval=1185670705 TSecr=648038406 WS=256"
"117","2.241858","10.90.119.247","17.253.57.208","TCP","66","60819  >  80 [ACK] Seq=1 Ack=1 Win=131392 Len=0 TSval=648038438 TSecr=1185670705"
"118","2.242247","10.90.119.247","17.253.57.208","HTTP","366","GET /ocsp04-devid01/ME4wTKADAgEAMEUwQzBBMAkGBSsOAwIaBQAEFDOB0e%2FbaLCFIU0u76%2BMSmlkPCpsBBRXF%2B2iz9x8mKEQ4Py%2Bhy0s8uMXVAIIRWsEIQLDCFo%3D HTTP/1.1 "
"119","2.274509","17.253.57.208","10.90.119.247","TCP","66","80  >  60819 [ACK] Seq=1 Ack=301 Win=64768 Len=0 TSval=1185670737 TSecr=648038438"
"120","2.279291","17.253.57.208","10.90.119.247","TCP","1510","80  >  60819 [ACK] Seq=1 Ack=301 Win=64768 Len=1444 TSval=1185670740 TSecr=648038438 [TCP segment of a reassembled PDU]"
"121","2.279593","17.253.57.208","10.90.119.247","TCP","255","[TCP Previous segment not captured] 80  >  60819 [PSH, ACK] Seq=2889 Ack=301 Win=64768 Len=189 TSval=1185670740 TSecr=648038438 [TCP segment of a reassembled PDU]"
"122","2.279595","17.253.57.208","10.90.119.247","TCP","1510","[TCP Out-Of-Order] 80  >  60819 [PSH, ACK] Seq=1445 Ack=301 Win=64768 Len=1444 TSval=1185670740 TSecr=648038438"
"123","2.279656","10.90.119.247","17.253.57.208","TCP","78","60819  >  80 [ACK] Seq=301 Ack=1445 Win=131072 Len=0 TSval=648038474 TSecr=1185670740 SLE=2889 SRE=3078"
"124","2.279657","10.90.119.247","17.253.57.208","TCP","66","60819  >  80 [ACK] Seq=301 Ack=3078 Win=129408 Len=0 TSval=648038474 TSecr=1185670740"
"125","2.280879","10.90.119.247","17.253.57.208","TCP","66","60819  >  80 [FIN, ACK] Seq=301 Ack=3078 Win=131072 Len=0 TSval=648038475 TSecr=1185670740"
"126","2.283439","10.90.119.247","17.248.248.50","TLSv1.3","631","Application Data"
"127","2.283593","10.90.119.247","17.248.248.50","TLSv1.3","165","Application Data"
"128","2.312767","17.253.57.208","10.90.119.247","TCP","66","80  >  60819 [FIN, ACK] Seq=3078 Ack=302 Win=64768 Len=0 TSval=1185670775 TSecr=648038475"
"129","2.312771","17.248.248.50","10.90.119.247","TCP","66","443  >  60815 [ACK] Seq=10357 Ack=3094 Win=64128 Len=0 TSval=1092411241 TSecr=648038477"
"130","2.312879","10.90.119.247","17.253.57.208","TCP","66","60819  >  80 [ACK] Seq=302 Ack=3079 Win=131072 Len=0 TSval=648038506 TSecr=1185670775"
"131","2.313149","17.248.248.50","10.90.119.247","TCP","66","443  >  60815 [ACK] Seq=10357 Ack=3193 Win=64128 Len=0 TSval=1092411241 TSecr=648038477"
"132","2.323082","192.0.77.32","10.90.119.247","TLSv1.2","93","Application Data"
"133","2.323131","10.90.119.247","192.0.77.32","TCP","54","60687  >  443 [ACK] Seq=1 Ack=40 Win=4095 Len=0"
"134","2.323378","192.0.77.32","10.90.119.247","TLSv1.2","78","Application Data"
"135","2.323380","192.0.77.32","10.90.119.247","TCP","54","443  >  60687 [FIN, ACK] Seq=64 Ack=1 Win=62 Len=0"
"136","2.323391","10.90.119.247","192.0.77.32","TLSv1.2","93","Application Data"
"137","2.323442","10.90.119.247","192.0.77.32","TCP","54","60687  >  443 [ACK] Seq=40 Ack=64 Win=4095 Len=0"
"138","2.323442","10.90.119.247","192.0.77.32","TCP","54","60687  >  443 [ACK] Seq=40 Ack=65 Win=4095 Len=0"
"139","2.323737","10.90.119.247","192.0.77.32","TLSv1.2","78","Application Data"
"140","2.324432","10.90.119.247","192.0.77.32","TCP","54","60687  >  443 [RST, ACK] Seq=64 Ack=65 Win=4095 Len=0"
"141","2.335911","192.0.77.32","10.90.119.247","TCP","54","443  >  60687 [ACK] Seq=65 Ack=40 Win=62 Len=0"
"142","2.335916","192.0.77.32","10.90.119.247","TCP","54","443  >  60687 [RST, ACK] Seq=65 Ack=40 Win=62 Len=0"
"143","2.336025","192.0.77.32","10.90.119.247","TCP","54","443  >  60687 [RST] Seq=64 Win=0 Len=0"
"144","2.336053","10.90.119.247","192.0.77.32","TCP","54","60687  >  443 [RST] Seq=40 Win=0 Len=0"
"145","2.336185","192.0.77.32","10.90.119.247","TCP","54","443  >  60687 [RST] Seq=65 Win=0 Len=0"
"146","2.336876","192.0.77.32","10.90.119.247","TCP","54","443  >  60687 [RST] Seq=65 Win=0 Len=0"
"147","2.391791","17.248.248.50","10.90.119.247","TLSv1.3","1177","Application Data"
"148","2.391854","10.90.119.247","17.248.248.50","TCP","66","60815  >  443 [ACK] Seq=3193 Ack=11468 Win=129920 Len=0 TSval=648038583 TSecr=1092411320"
"149","2.409496","10.90.119.247","17.248.248.50","TLSv1.3","631","Application Data"
"150","2.409637","10.90.119.247","17.248.248.50","TLSv1.3","165","Application Data"
"151","2.441818","17.248.248.50","10.90.119.247","TCP","66","443  >  60815 [ACK] Seq=11468 Ack=3758 Win=64128 Len=0 TSval=1092411370 TSecr=648038600"
"152","2.441821","17.248.248.50","10.90.119.247","TCP","66","443  >  60815 [ACK] Seq=11468 Ack=3857 Win=64128 Len=0 TSval=1092411370 TSecr=648038600"
"153","2.442603","17.248.248.50","10.90.119.247","TLSv1.3","1176","Application Data"
"154","2.442640","10.90.119.247","17.248.248.50","TCP","66","60815  >  443 [ACK] Seq=3857 Ack=12578 Win=129920 Len=0 TSval=648038632 TSecr=1092411371"
"155","2.465198","10.90.119.247","17.248.248.50","TLSv1.3","631","Application Data"
"156","2.465422","10.90.119.247","17.248.248.50","TLSv1.3","165","Application Data"
"157","2.493563","17.248.248.50","10.90.119.247","TCP","66","443  >  60815 [ACK] Seq=12578 Ack=4422 Win=64128 Len=0 TSval=1092411423 TSecr=648038655"
"158","2.493565","17.248.248.50","10.90.119.247","TCP","66","443  >  60815 [ACK] Seq=12578 Ack=4521 Win=64128 Len=0 TSval=1092411423 TSecr=648038655"
"159","2.495061","17.248.248.50","10.90.119.247","TLSv1.3","1176","Application Data"
"160","2.495105","10.90.119.247","17.248.248.50","TCP","66","60815  >  443 [ACK] Seq=4521 Ack=13688 Win=129920 Len=0 TSval=648038684 TSecr=1092411424"
"161","2.512045","10.90.119.247","17.248.248.50","TLSv1.3","631","Application Data"
"162","2.512283","10.90.119.247","17.248.248.50","TLSv1.3","165","Application Data"
"163","2.540360","17.248.248.50","10.90.119.247","TCP","66","443  >  60815 [ACK] Seq=13688 Ack=5185 Win=64128 Len=0 TSval=1092411470 TSecr=648038700"
"164","2.543949","17.248.248.50","10.90.119.247","TLSv1.3","1175","Application Data"
"165","2.543990","10.90.119.247","17.248.248.50","TCP","66","60815  >  443 [ACK] Seq=5185 Ack=14797 Win=129920 Len=0 TSval=648038730 TSecr=1092411472"
"166","2.558912","10.90.119.247","17.253.57.203","TCP","78","60820  >  80 [SYN, ECE, CWR] Seq=0 Win=65535 Len=0 MSS=1460 WS=64 TSval=648038744 TSecr=0 SACK_PERM"
"167","2.587388","17.253.57.203","10.90.119.247","TCP","74","80  >  60820 [SYN, ACK, ECE] Seq=0 Ack=1 Win=64980 Len=0 MSS=1456 SACK_PERM TSval=1898150281 TSecr=648038744 WS=256"
"168","2.587447","10.90.119.247","17.253.57.203","TCP","66","60820  >  80 [ACK] Seq=1 Ack=1 Win=131392 Len=0 TSval=648038772 TSecr=1898150281"
"169","2.587870","10.90.119.247","17.253.57.203","HTTP","370","GET /ocsp04-devid01/ME4wTKADAgEAMEUwQzBBMAkGBSsOAwIaBQAEFDOB0e%2FbaLCFIU0u76%2BMSmlkPCpsBBRXF%2B2iz9x8mKEQ4Py%2Bhy0s8uMXVAIIFAtt%2B0l%2BnUE%3D HTTP/1.1 "
"170","2.606766","10.90.119.247","151.100.4.2","DNS","96","Standard query 0x6d6e A mesu-cdn.origin-apple.com.akadns.net"
"171","2.607467","10.90.119.247","17.253.15.203","TCP","78","60821  >  443 [SYN, ECE, CWR] Seq=0 Win=65535 Len=0 MSS=1460 WS=64 TSval=648038790 TSecr=0 SACK_PERM"
"172","2.613747","151.100.4.2","10.90.119.247","DNS","160","Standard query response 0x6d6e A mesu-cdn.origin-apple.com.akadns.net CNAME mesu.g.aaplimg.com A 17.253.57.204 A 17.253.57.208"
"173","2.613795","10.90.119.247","151.100.4.2","ICMP","70","Destination unreachable (Port unreachable)"
"174","2.615691","17.253.57.203","10.90.119.247","TCP","66","80  >  60820 [ACK] Seq=1 Ack=305 Win=64768 Len=0 TSval=1898150310 TSecr=648038772"
"175","2.618394","17.253.57.203","10.90.119.247","TCP","1510","80  >  60820 [ACK] Seq=1 Ack=305 Win=64768 Len=1444 TSval=1898150310 TSecr=648038772 [TCP segment of a reassembled PDU]"
"176","2.618487","17.253.57.203","10.90.119.247","TCP","1510","80  >  60820 [PSH, ACK] Seq=1445 Ack=305 Win=64768 Len=1444 TSval=1898150310 TSecr=648038772 [TCP segment of a reassembled PDU]"
"177","2.618488","17.253.57.203","10.90.119.247","OCSP","255","Response"
"178","2.618527","10.90.119.247","17.253.57.203","TCP","66","60820  >  80 [ACK] Seq=305 Ack=2889 Win=129600 Len=0 TSval=648038800 TSecr=1898150310"
"179","2.618527","10.90.119.247","17.253.57.203","TCP","66","60820  >  80 [ACK] Seq=305 Ack=3078 Win=129408 Len=0 TSval=648038800 TSecr=1898150310"
"180","2.619789","10.90.119.247","17.253.57.203","TCP","66","60820  >  80 [FIN, ACK] Seq=305 Ack=3078 Win=131072 Len=0 TSval=648038801 TSecr=1898150310"
"181","2.622082","10.90.119.247","17.248.248.50","TLSv1.3","631","Application Data"
"182","2.622288","10.90.119.247","17.248.248.50","TLSv1.3","165","Application Data"
"183","2.639960","17.253.15.203","10.90.119.247","TCP","74","443  >  60821 [SYN, ACK, ECE] Seq=0 Ack=1 Win=64980 Len=0 MSS=1456 SACK_PERM TSval=2193331489 TSecr=648038790 WS=256"
"184","2.640020","10.90.119.247","17.253.15.203","TCP","66","60821  >  443 [ACK] Seq=1 Ack=1 Win=131392 Len=0 TSval=648038820 TSecr=2193331489"
"185","2.640465","10.90.119.247","17.253.15.203","TLSv1.3","583","Client Hello"
"186","2.648894","17.253.57.203","10.90.119.247","TCP","66","80  >  60820 [FIN, ACK] Seq=3078 Ack=306 Win=64768 Len=0 TSval=1898150343 TSecr=648038801"
"187","2.648947","10.90.119.247","17.253.57.203","TCP","66","60820  >  80 [ACK] Seq=306 Ack=3079 Win=131072 Len=0 TSval=648038828 TSecr=1898150343"
"188","2.650713","17.248.248.50","10.90.119.247","TCP","66","443  >  60815 [ACK] Seq=14797 Ack=5849 Win=64128 Len=0 TSval=1092411580 TSecr=648038803"
"189","2.651651","17.248.248.50","10.90.119.247","TCP","1514","443  >  60815 [ACK] Seq=14797 Ack=5849 Win=64128 Len=1448 TSval=1092411581 TSecr=648038803 [TCP segment of a reassembled PDU]"
"190","2.652001","17.248.248.50","10.90.119.247","TLSv1.3","1258","Application Data"
"191","2.652030","10.90.119.247","17.248.248.50","TCP","66","60815  >  443 [ACK] Seq=5849 Ack=17437 Win=129856 Len=0 TSval=648038830 TSecr=1092411581"
"192","2.671537","17.253.15.203","10.90.119.247","TCP","66","443  >  60821 [ACK] Seq=1 Ack=518 Win=64512 Len=0 TSval=2193331521 TSecr=648038820"
"193","2.671984","17.253.15.203","10.90.119.247","TLSv1.3","1510","Server Hello, Change Cipher Spec, Application Data"
"194","2.672332","17.253.15.203","10.90.119.247","TCP","1510","443  >  60821 [PSH, ACK] Seq=1445 Ack=518 Win=64512 Len=1444 TSval=2193331522 TSecr=648038820 [TCP segment of a reassembled PDU]"
"195","2.672334","17.253.15.203","10.90.119.247","TCP","1274","443  >  60821 [PSH, ACK] Seq=2889 Ack=518 Win=64512 Len=1208 TSval=2193331522 TSecr=648038820 [TCP segment of a reassembled PDU]"
"196","2.672384","10.90.119.247","17.253.15.203","TCP","66","60821  >  443 [ACK] Seq=518 Ack=2889 Win=129600 Len=0 TSval=648038850 TSecr=2193331522"
"197","2.672384","10.90.119.247","17.253.15.203","TCP","66","60821  >  443 [ACK] Seq=518 Ack=4097 Win=128384 Len=0 TSval=648038850 TSecr=2193331522"
"198","2.672571","17.253.15.203","10.90.119.247","TLSv1.3","880","Application Data, Application Data, Application Data"
"199","2.672599","10.90.119.247","17.253.15.203","TCP","66","60821  >  443 [ACK] Seq=518 Ack=4911 Win=130240 Len=0 TSval=648038850 TSecr=2193331522"
"200","2.678868","10.90.119.247","17.253.15.203","TLSv1.3","130","Change Cipher Spec, Application Data"
"201","2.680432","10.90.119.247","17.253.15.203","TLSv1.3","449","Application Data"
"202","2.690904","10.90.119.247","17.248.248.50","TLSv1.3","631","Application Data"
"203","2.691069","10.90.119.247","17.248.248.50","TLSv1.3","165","Application Data"
"204","2.707273","17.253.15.203","10.90.119.247","TCP","66","443  >  60821 [ACK] Seq=4911 Ack=582 Win=64512 Len=0 TSval=2193331558 TSecr=648038856"
"205","2.707519","17.253.15.203","10.90.119.247","TLSv1.3","353","Application Data"
"206","2.707520","17.253.15.203","10.90.119.247","TLSv1.3","353","Application Data"
"207","2.707556","10.90.119.247","17.253.15.203","TCP","66","60821  >  443 [ACK] Seq=965 Ack=5198 Win=130752 Len=0 TSval=648038882 TSecr=2193331558"
"208","2.707556","10.90.119.247","17.253.15.203","TCP","66","60821  >  443 [ACK] Seq=965 Ack=5485 Win=130496 Len=0 TSval=648038882 TSecr=2193331558"
"209","2.708192","17.253.15.203","10.90.119.247","TCP","66","443  >  60821 [ACK] Seq=5485 Ack=965 Win=64256 Len=0 TSval=2193331559 TSecr=648038857"
"210","2.709147","17.253.15.203","10.90.119.247","TLSv1.3","416","Application Data"
"211","2.709173","10.90.119.247","17.253.15.203","TCP","66","60821  >  443 [ACK] Seq=965 Ack=5835 Win=130688 Len=0 TSval=648038883 TSecr=2193331559"
"212","2.718757","17.248.248.50","10.90.119.247","TCP","66","443  >  60815 [ACK] Seq=17437 Ack=6513 Win=64128 Len=0 TSval=1092411648 TSecr=648038866"
"213","2.721031","17.248.248.50","10.90.119.247","TLSv1.3","1176","Application Data"
"214","2.721088","10.90.119.247","17.248.248.50","TCP","66","60815  >  443 [ACK] Seq=6513 Ack=18547 Win=129920 Len=0 TSval=648038894 TSecr=1092411650"
"215","3.080224","10.90.119.247","104.85.8.139","TLSv1.2","90","Application Data"
"216","3.080943","10.90.119.247","104.85.8.139","TCP","66","60773  >  443 [FIN, ACK] Seq=25 Ack=1 Win=2048 Len=0 TSval=648039251 TSecr=596555787"
"217","3.093771","104.85.8.139","10.90.119.247","TCP","66","443  >  60773 [ACK] Seq=1 Ack=25 Win=503 Len=0 TSval=596615609 TSecr=648039251"
"218","3.093773","104.85.8.139","10.90.119.247","TLSv1.2","90","Application Data"
"219","3.093843","10.90.119.247","104.85.8.139","TCP","54","60773  >  443 [RST] Seq=26 Win=0 Len=0"
"220","3.093956","104.85.8.139","10.90.119.247","TCP","66","443  >  60773 [RST, ACK] Seq=25 Ack=26 Win=503 Len=0 TSval=596615609 TSecr=648039251"
"221","3.255731","192.0.78.17","10.90.119.247","TLSv1.2","93","Application Data"
"222","3.255801","10.90.119.247","192.0.78.17","TCP","54","60663  >  443 [ACK] Seq=1 Ack=40 Win=32767 Len=0"
"223","3.255953","192.0.78.17","10.90.119.247","TLSv1.2","78","Application Data"
"224","3.255955","192.0.78.17","10.90.119.247","TCP","54","443  >  60663 [FIN, ACK] Seq=64 Ack=1 Win=111 Len=0"
"225","3.255993","10.90.119.247","192.0.78.17","TCP","54","60663  >  443 [ACK] Seq=1 Ack=64 Win=32767 Len=0"
"226","3.255994","10.90.119.247","192.0.78.17","TCP","54","60663  >  443 [ACK] Seq=1 Ack=65 Win=32767 Len=0"
"227","3.256043","10.90.119.247","192.0.78.17","TLSv1.2","93","Application Data"
"228","3.256290","10.90.119.247","192.0.78.17","TLSv1.2","78","Application Data"
"229","3.257005","10.90.119.247","192.0.78.17","TCP","54","60663  >  443 [RST, ACK] Seq=64 Ack=65 Win=32767 Len=0"
"230","3.274598","192.0.78.17","10.90.119.247","TCP","54","443  >  60663 [RST, ACK] Seq=65 Ack=64 Win=111 Len=0"
"231","3.665037","162.125.19.131","10.90.119.247","TLSv1.2","184","Application Data"
"232","3.665104","10.90.119.247","162.125.19.131","TCP","66","60651  >  443 [ACK] Seq=1 Ack=119 Win=2046 Len=0 TSval=648039831 TSecr=1536084583"
"233","4.000373","10.90.119.247","17.253.108.253","NTP","90","NTP Version 4, client"
"234","4.186661","Cisco_7d:ab:a0","Broadcast","ARP","42","Gratuitous ARP for 10.90.110.158 (Request)"
"235","4.645264","10.90.119.247","17.253.15.203","TLSv1.3","90","Application Data"
"236","4.645979","10.90.119.247","17.253.15.203","TCP","66","60821  >  443 [FIN, ACK] Seq=989 Ack=5835 Win=131072 Len=0 TSval=648040810 TSecr=2193331559"
"237","4.674905","17.253.15.203","10.90.119.247","TCP","66","443  >  60821 [ACK] Seq=5835 Ack=989 Win=64256 Len=0 TSval=2193333525 TSecr=648040810"
"238","4.675087","17.253.15.203","10.90.119.247","TCP","66","443  >  60821 [FIN, ACK] Seq=5835 Ack=990 Win=64256 Len=0 TSval=2193333525 TSecr=648040810"
"239","4.675138","10.90.119.247","17.253.15.203","TCP","66","60821  >  443 [ACK] Seq=990 Ack=5836 Win=131072 Len=0 TSval=648040839 TSecr=2193333525"
"240","5.021038","10.90.119.247","17.248.248.50","TLSv1.3","631","Application Data"
"241","5.021283","10.90.119.247","17.248.248.50","TLSv1.3","165","Application Data"
"242","5.050037","17.248.248.50","10.90.119.247","TCP","66","443  >  60815 [ACK] Seq=18547 Ack=7177 Win=64128 Len=0 TSval=1092413979 TSecr=648041184"
"243","5.053313","17.248.248.50","10.90.119.247","TLSv1.3","1176","Application Data"
"244","5.053354","10.90.119.247","17.248.248.50","TCP","66","60815  >  443 [ACK] Seq=7177 Ack=19657 Win=129920 Len=0 TSval=648041215 TSecr=1092413981"
"245","5.074415","10.90.119.247","17.248.248.50","TLSv1.3","631","Application Data"
"246","5.074570","10.90.119.247","17.248.248.50","TLSv1.3","165","Application Data"
"247","5.085649","192.0.77.32","10.90.119.247","TLSv1.2","93","Application Data"
"248","5.085701","10.90.119.247","192.0.77.32","TCP","54","60718  >  443 [ACK] Seq=1 Ack=40 Win=32767 Len=0"
"249","5.085805","192.0.77.32","10.90.119.247","TLSv1.2","78","Application Data"
"250","5.085840","10.90.119.247","192.0.77.32","TCP","54","60718  >  443 [ACK] Seq=1 Ack=64 Win=32767 Len=0"
"251","5.085886","10.90.119.247","192.0.77.32","TLSv1.2","93","Application Data"
"252","5.086166","10.90.119.247","192.0.77.32","TLSv1.2","78","Application Data"
"253","5.086539","10.90.119.247","192.0.77.32","TCP","54","60718  >  443 [RST, ACK] Seq=64 Ack=64 Win=32767 Len=0"
"254","5.087123","192.0.77.32","10.90.119.247","TCP","54","443  >  60718 [FIN, ACK] Seq=64 Ack=1 Win=62 Len=0"
"255","5.087151","10.90.119.247","192.0.77.32","TCP","54","60718  >  443 [RST] Seq=1 Win=0 Len=0"
"256","5.095616","192.0.77.32","10.90.119.247","TCP","54","443  >  60718 [RST, ACK] Seq=65 Ack=40 Win=62 Len=0"
"257","5.096228","192.0.77.32","10.90.119.247","TCP","54","443  >  60718 [RST] Seq=64 Win=0 Len=0"
"258","5.102361","17.248.248.50","10.90.119.247","TCP","66","443  >  60815 [ACK] Seq=19657 Ack=7841 Win=64128 Len=0 TSval=1092414032 TSecr=648041236"
"259","5.106968","17.248.248.50","10.90.119.247","TLSv1.3","1175","Application Data"
"260","5.107003","10.90.119.247","17.248.248.50","TCP","66","60815  >  443 [ACK] Seq=7841 Ack=20766 Win=129920 Len=0 TSval=648041265 TSecr=1092414033"
"261","5.145408","10.90.119.247","17.248.248.50","TLSv1.3","631","Application Data"
"262","5.145722","10.90.119.247","17.248.248.50","TLSv1.3","165","Application Data"
"263","5.174683","17.248.248.50","10.90.119.247","TCP","66","443  >  60815 [ACK] Seq=20766 Ack=8505 Win=64128 Len=0 TSval=1092414104 TSecr=648041302"
"264","5.176633","17.248.248.50","10.90.119.247","TCP","1514","443  >  60815 [ACK] Seq=20766 Ack=8505 Win=64128 Len=1448 TSval=1092414105 TSecr=648041302 [TCP segment of a reassembled PDU]"
"265","5.176990","17.248.248.50","10.90.119.247","TCP","1514","443  >  60815 [PSH, ACK] Seq=22214 Ack=8505 Win=64128 Len=1448 TSval=1092414105 TSecr=648041302 [TCP segment of a reassembled PDU]"
"266","5.177031","10.90.119.247","17.248.248.50","TCP","66","60815  >  443 [ACK] Seq=8505 Ack=23662 Win=129600 Len=0 TSval=648041332 TSecr=1092414105"
"267","5.177232","17.248.248.50","10.90.119.247","TLSv1.3","104","Application Data"
"268","5.177261","10.90.119.247","17.248.248.50","TCP","66","60815  >  443 [ACK] Seq=8505 Ack=23700 Win=131008 Len=0 TSval=648041332 TSecr=1092414106"
"269","5.221568","10.90.119.247","17.248.248.50","TLSv1.3","631","Application Data"
"270","5.221738","10.90.119.247","17.248.248.50","TLSv1.3","165","Application Data"
"271","5.251719","17.248.248.50","10.90.119.247","TCP","66","443  >  60815 [ACK] Seq=23700 Ack=9169 Win=64128 Len=0 TSval=1092414181 TSecr=648041376"
"272","5.253140","17.248.248.50","10.90.119.247","TLSv1.3","1176","Application Data"
"273","5.253184","10.90.119.247","17.248.248.50","TCP","66","60815  >  443 [ACK] Seq=9169 Ack=24810 Win=129920 Len=0 TSval=648041407 TSecr=1092414182"
"274","5.271048","10.90.119.247","17.248.248.50","TLSv1.3","631","Application Data"
"275","5.271246","10.90.119.247","17.248.248.50","TLSv1.3","165","Application Data"
"276","5.300588","17.248.248.50","10.90.119.247","TCP","66","443  >  60815 [ACK] Seq=24810 Ack=9833 Win=64128 Len=0 TSval=1092414229 TSecr=648041424"
"277","5.301713","17.248.248.50","10.90.119.247","TCP","1514","443  >  60815 [ACK] Seq=24810 Ack=9833 Win=64128 Len=1448 TSval=1092414230 TSecr=648041424 [TCP segment of a reassembled PDU]"
"278","5.301967","17.248.248.50","10.90.119.247","TLSv1.3","1373","Application Data"
"279","5.302026","10.90.119.247","17.248.248.50","TCP","66","60815  >  443 [ACK] Seq=9833 Ack=27565 Win=129728 Len=0 TSval=648041453 TSecr=1092414230"
"280","5.345710","10.90.119.247","17.248.248.50","TLSv1.3","631","Application Data"
"281","5.345895","10.90.119.247","17.248.248.50","TLSv1.3","165","Application Data"
"282","5.379447","17.248.248.50","10.90.119.247","TCP","66","443  >  60815 [ACK] Seq=27565 Ack=10497 Win=64128 Len=0 TSval=1092414305 TSecr=648041496"
"283","5.383141","17.248.248.50","10.90.119.247","TCP","1514","443  >  60815 [ACK] Seq=27565 Ack=10497 Win=64128 Len=1448 TSval=1092414307 TSecr=648041496 [TCP segment of a reassembled PDU]"
"284","5.383143","17.248.248.50","10.90.119.247","TLSv1.3","1273","Application Data"
"285","5.383205","10.90.119.247","17.248.248.50","TCP","66","60815  >  443 [ACK] Seq=10497 Ack=30220 Win=128384 Len=0 TSval=648041532 TSecr=1092414307"
"286","5.424986","10.90.119.247","17.248.248.50","TLSv1.3","631","Application Data"
"287","5.425159","10.90.119.247","17.248.248.50","TLSv1.3","165","Application Data"
"288","5.472207","17.248.248.50","10.90.119.247","TCP","66","443  >  60815 [ACK] Seq=30220 Ack=11161 Win=64128 Len=0 TSval=1092414387 TSecr=648041572"
"289","5.474114","17.248.248.50","10.90.119.247","TCP","1514","443  >  60815 [ACK] Seq=30220 Ack=11161 Win=64128 Len=1448 TSval=1092414389 TSecr=648041572 [TCP segment of a reassembled PDU]"
"290","5.474431","17.248.248.50","10.90.119.247","TLSv1.3","1372","Application Data"
"291","5.474469","10.90.119.247","17.248.248.50","TCP","66","60815  >  443 [ACK] Seq=11161 Ack=32974 Win=129728 Len=0 TSval=648041620 TSecr=1092414389"
"292","5.515167","10.90.119.247","17.248.248.50","TLSv1.3","631","Application Data"
"293","5.515344","10.90.119.247","17.248.248.50","TLSv1.3","165","Application Data"
"294","5.562757","17.248.248.50","10.90.119.247","TCP","66","443  >  60815 [ACK] Seq=32974 Ack=11825 Win=64128 Len=0 TSval=1092414472 TSecr=648041660"
"295","5.564544","17.248.248.50","10.90.119.247","TLSv1.3","1175","Application Data"
"296","5.564601","10.90.119.247","17.248.248.50","TCP","66","60815  >  443 [ACK] Seq=11825 Ack=34083 Win=129920 Len=0 TSval=648041708 TSecr=1092414474"
"297","5.580672","10.90.119.247","17.248.248.50","TLSv1.3","631","Application Data"
"298","5.580843","10.90.119.247","17.248.248.50","TLSv1.3","165","Application Data"
"299","5.616761","17.248.248.50","10.90.119.247","TCP","66","443  >  60815 [ACK] Seq=34083 Ack=12489 Win=64128 Len=0 TSval=1092414545 TSecr=648041724"
"300","5.617805","17.248.248.50","10.90.119.247","TLSv1.3","1176","Application Data"
"301","5.617852","10.90.119.247","17.248.248.50","TCP","66","60815  >  443 [ACK] Seq=12489 Ack=35193 Win=129920 Len=0 TSval=648041760 TSecr=1092414546"
"302","5.632558","10.90.119.247","17.248.248.50","TLSv1.3","631","Application Data"
"303","5.632756","10.90.119.247","17.248.248.50","TLSv1.3","165","Application Data"
"304","5.669413","17.248.248.50","10.90.119.247","TCP","66","443  >  60815 [ACK] Seq=35193 Ack=13153 Win=64128 Len=0 TSval=1092414590 TSecr=648041774"
"305","5.671304","17.248.248.50","10.90.119.247","TCP","1514","443  >  60815 [ACK] Seq=35193 Ack=13153 Win=64128 Len=1448 TSval=1092414592 TSecr=648041774 [TCP segment of a reassembled PDU]"
"306","5.672457","17.248.248.50","10.90.119.247","TLSv1.3","1370","Application Data"
"307","5.672500","10.90.119.247","17.248.248.50","TCP","66","60815  >  443 [ACK] Seq=13153 Ack=37945 Win=129728 Len=0 TSval=648041812 TSecr=1092414592"
"308","5.708527","10.90.119.247","17.248.248.50","TLSv1.3","631","Application Data"
"309","5.708695","10.90.119.247","17.248.248.50","TLSv1.3","165","Application Data"
"310","5.737604","17.248.248.50","10.90.119.247","TCP","66","443  >  60815 [ACK] Seq=37945 Ack=13817 Win=64128 Len=0 TSval=1092414667 TSecr=648041847"
"311","5.739886","17.248.248.50","10.90.119.247","TLSv1.3","1176","Application Data"
"312","5.739934","10.90.119.247","17.248.248.50","TCP","66","60815  >  443 [ACK] Seq=13817 Ack=39055 Win=129920 Len=0 TSval=648041878 TSecr=1092414668"
"313","5.748746","10.90.119.247","17.248.248.50","TLSv1.3","631","Application Data"
"314","5.748909","10.90.119.247","17.248.248.50","TLSv1.3","165","Application Data"
"315","5.781371","17.248.248.50","10.90.119.247","TCP","66","443  >  60815 [ACK] Seq=39055 Ack=14481 Win=64128 Len=0 TSval=1092414711 TSecr=648041886"
"316","5.783889","17.248.248.50","10.90.119.247","TLSv1.3","1176","Application Data"
